{
  "schema": "backtest-report/v0",
  "generated_at": "2026-10-15 20:32:55 CST",
  "data_sources": [
    "/workspace/majiang-bot/brain_v0/data/backtest/analyze_r01_1015/replay_latest.json",
    "/workspace/majiang-data/replay_harvest/2026-10-15/r01/meta.json",
    "/workspace/majiang-bot/brain_v0/data/backtest/analyze_r01_1014/replay_latest.json",
    "/workspace/majiang-data/replay_harvest/2026-10-14/r01/meta.json",
    "/workspace/majiang-bot/brain_v0/data/backtest/analyze_r02_1014/replay_latest.json",
    "/workspace/majiang-data/replay_harvest/2026-10-14/r02/meta.json",
    "/workspace/majiang-bot/pc_bot/logs/decisions.jsonl"
  ],
  "user_account": "晓红",
  "n_rounds": 3,
  "n_decision_points": 10,
  "n_actual_missing": 10,
  "n_comparable": 0,
  "n_agree": 0,
  "n_errors": 0,
  "agree_rate": null,
  "agree_rate_display": "N/A",
  "agreement_rate_note": "N/A: 无 actual_discard/actual_action 真值（actual_missing）",
  "shanten_summary": {
    "before_avg": 1.9,
    "after_bot_avg": 2.0,
    "after_actual_avg": null
  },
  "ukeire_summary": {
    "bot_avg": 43.7,
    "actual_avg": null,
    "ting_count_avg": 0.0
  },
  "points": [
    {
      "round_uid": "346299-2026-10-15-r01",
      "idx": 0,
      "turn_no": 3,
      "is_hand14": false,
      "bot_tile": null,
      "actual_discard": null,
      "actual_missing": true,
      "agree": null,
      "shanten_before": 2,
      "shanten_after_bot": null,
      "ukeire_count_bot": 28,
      "error": null,
      "source": "replay_analyze",
      "frame_name": "frame_03.png"
    },
    {
      "round_uid": "346299-2026-10-15-r01",
      "idx": 1,
      "turn_no": 4,
      "is_hand14": false,
      "bot_tile": null,
      "actual_discard": null,
      "actual_missing": true,
      "agree": null,
      "shanten_before": 1,
      "shanten_after_bot": null,
      "ukeire_count_bot": 20,
      "error": null,
      "source": "replay_analyze",
      "frame_name": "frame_04.png"
    },
    {
      "round_uid": "346299-2026-10-15-r01",
      "idx": 2,
      "turn_no": 5,
      "is_hand14": false,
      "bot_tile": null,
      "actual_discard": null,
      "actual_missing": true,
      "agree": null,
      "shanten_before": 1,
      "shanten_after_bot": null,
      "ukeire_count_bot": 20,
      "error": null,
      "source": "replay_analyze",
      "frame_name": "frame_05.png"
    },
    {
      "round_uid": "302805-2026-10-14-r01",
      "idx": 3,
      "turn_no": 2,
      "is_hand14": false,
      "bot_tile": null,
      "actual_discard": null,
      "actual_missing": true,
      "agree": null,
      "shanten_before": 2,
      "shanten_after_bot": null,
      "ukeire_count_bot": 56,
      "error": null,
      "source": "replay_analyze",
      "frame_name": "frame_02.png"
    },
    {
      "round_uid": "302805-2026-10-14-r01",
      "idx": 4,
      "turn_no": 3,
      "is_hand14": false,
      "bot_tile": null,
      "actual_discard": null,
      "actual_missing": true,
      "agree": null,
      "shanten_before": 2,
      "shanten_after_bot": null,
      "ukeire_count_bot": 56,
      "error": null,
      "source": "replay_analyze",
      "frame_name": "frame_03.png"
    },
    {
      "round_uid": "302805-2026-10-14-r01",
      "idx": 5,
      "turn_no": 4,
      "is_hand14": false,
      "bot_tile": null,
      "actual_discard": null,
      "actual_missing": true,
      "agree": null,
      "shanten_before": 2,
      "shanten_after_bot": null,
      "ukeire_count_bot": 56,
      "error": null,
      "source": "replay_analyze",
      "frame_name": "frame_04.png"
    },
    {
      "round_uid": "302805-2026-10-14-r02",
      "idx": 6,
      "turn_no": 2,
      "is_hand14": false,
      "bot_tile": null,
      "actual_discard": null,
      "actual_missing": true,
      "agree": null,
      "shanten_before": 3,
      "shanten_after_bot": null,
      "ukeire_count_bot": 51,
      "error": null,
      "source": "replay_analyze",
      "frame_name": "frame_02.png"
    },
    {
      "round_uid": "decisions-adapt-decisions",
      "idx": 7,
      "turn_no": 1,
      "is_hand14": true,
      "bot_tile": 8,
      "actual_discard": null,
      "actual_missing": true,
      "agree": null,
      "shanten_before": 2,
      "shanten_after_bot": 2,
      "ukeire_count_bot": 50,
      "error": null,
      "source": "decisions.jsonl",
      "frame_name": null
    },
    {
      "round_uid": "decisions-adapt-decisions",
      "idx": 8,
      "turn_no": 1,
      "is_hand14": true,
      "bot_tile": 8,
      "actual_discard": null,
      "actual_missing": true,
      "agree": null,
      "shanten_before": 2,
      "shanten_after_bot": 2,
      "ukeire_count_bot": 50,
      "error": null,
      "source": "decisions.jsonl",
      "frame_name": null
    },
    {
      "round_uid": "decisions-adapt-decisions",
      "idx": 9,
      "turn_no": 1,
      "is_hand14": true,
      "bot_tile": 8,
      "actual_discard": null,
      "actual_missing": true,
      "agree": null,
      "shanten_before": 2,
      "shanten_after_bot": 2,
      "ukeire_count_bot": 50,
      "error": null,
      "source": "decisions.jsonl",
      "frame_name": null
    }
  ],
  "blockers": [
    "3局 harvest 帧均无 hand14：弃牌决策点仅来自 decisions.jsonl 或 hand13 听牌态",
    "全部决策点 actual_missing：无 frame_diff/manual_gold 真值，agree_rate=N/A",
    "frame_diff 未命中：相邻 gameplay 帧无「多重集合恰好少1张」的 14→13 过渡"
  ],
  "rounds": [
    {
      "round_uid": "346299-2026-10-15-r01",
      "n_decision_points": 3,
      "n_actual_missing": 3,
      "n_hand14": 0,
      "n_hand13": 3,
      "agreement_rate": null,
      "notes": "from harvest meta + analyze; gameplay_decisions=3; frame_diff_actuals=0"
    },
    {
      "round_uid": "302805-2026-10-14-r01",
      "n_decision_points": 3,
      "n_actual_missing": 3,
      "n_hand14": 0,
      "n_hand13": 3,
      "agreement_rate": null,
      "notes": "from harvest meta + analyze; gameplay_decisions=3; frame_diff_actuals=0"
    },
    {
      "round_uid": "302805-2026-10-14-r02",
      "n_decision_points": 1,
      "n_actual_missing": 1,
      "n_hand14": 0,
      "n_hand13": 1,
      "agreement_rate": null,
      "notes": "from harvest meta + analyze; gameplay_decisions=1; frame_diff_actuals=0"
    },
    {
      "round_uid": "decisions-adapt-decisions",
      "n_decision_points": 3,
      "n_actual_missing": 3,
      "n_hand14": 3,
      "n_hand13": 0,
      "agreement_rate": null,
      "notes": "adapted from /workspace/majiang-bot/pc_bot/logs/decisions.jsonl; n=3; actual usually missing"
    }
  ],
  "rows_detail": [
    {
      "turn_no": 3,
      "hand": [
        4,
        5,
        7,
        8,
        8,
        45,
        46,
        47,
        49,
        49,
        22,
        24,
        26
      ],
      "open_meld_count": 0,
      "is_hand14": false,
      "joker": 55,
      "actual_missing": true,
      "actual_discard": null,
      "actual_discard_source": "none",
      "suggested_discard_log": null,
      "bot_action": null,
      "agree": null,
      "shanten_before": 2,
      "shanten_after_bot": null,
      "shanten_after_actual": null,
      "ting_count": 0,
      "ukeire_count_bot": 28,
      "ukeire_count_actual": null,
      "error": null,
      "round_uid": "346299-2026-10-15-r01",
      "source": "replay_analyze",
      "frame_name": "frame_03.png"
    },
    {
      "turn_no": 4,
      "hand": [
        4,
        5,
        8,
        8,
        45,
        46,
        47,
        49,
        49,
        49,
        22,
        24,
        26
      ],
      "open_meld_count": 0,
      "is_hand14": false,
      "joker": 55,
      "actual_missing": true,
      "actual_discard": null,
      "actual_discard_source": "none",
      "suggested_discard_log": null,
      "bot_action": null,
      "agree": null,
      "shanten_before": 1,
      "shanten_after_bot": null,
      "shanten_after_actual": null,
      "ting_count": 0,
      "ukeire_count_bot": 20,
      "ukeire_count_actual": null,
      "error": null,
      "round_uid": "346299-2026-10-15-r01",
      "source": "replay_analyze",
      "frame_name": "frame_04.png"
    },
    {
      "turn_no": 5,
      "hand": [
        4,
        5,
        8,
        8,
        45,
        46,
        47,
        49,
        49,
        49,
        22,
        24,
        26
      ],
      "open_meld_count": 0,
      "is_hand14": false,
      "joker": 55,
      "actual_missing": true,
      "actual_discard": null,
      "actual_discard_source": "none",
      "suggested_discard_log": null,
      "bot_action": null,
      "agree": null,
      "shanten_before": 1,
      "shanten_after_bot": null,
      "shanten_after_actual": null,
      "ting_count": 0,
      "ukeire_count_bot": 20,
      "ukeire_count_actual": null,
      "error": null,
      "round_uid": "346299-2026-10-15-r01",
      "source": "replay_analyze",
      "frame_name": "frame_05.png"
    },
    {
      "turn_no": 2,
      "hand": [
        55,
        1,
        2,
        3,
        6,
        47,
        49,
        22,
        22,
        24,
        25,
        25,
        29
      ],
      "open_meld_count": 0,
      "is_hand14": false,
      "joker": 55,
      "actual_missing": true,
      "actual_discard": null,
      "actual_discard_source": "none",
      "suggested_discard_log": null,
      "bot_action": null,
      "agree": null,
      "shanten_before": 2,
      "shanten_after_bot": null,
      "shanten_after_actual": null,
      "ting_count": 0,
      "ukeire_count_bot": 56,
      "ukeire_count_actual": null,
      "error": null,
      "round_uid": "302805-2026-10-14-r01",
      "source": "replay_analyze",
      "frame_name": "frame_02.png"
    },
    {
      "turn_no": 3,
      "hand": [
        55,
        1,
        2,
        3,
        6,
        47,
        49,
        22,
        22,
        24,
        25,
        25,
        29
      ],
      "open_meld_count": 0,
      "is_hand14": false,
      "joker": 55,
      "actual_missing": true,